<?xml version='1.0' encoding='utf-8'?>

<World
  xmlns:xsi="http://www.w3.org/2001/XMLSchema-instance"
  xsi:noNamespaceSchemaLocation="World.xsd">

  <Textures>
    <Generated>
      <Texture Name="Palm.png" GenerationRGBColor="AB9283" GenerationMode="Always" Base="BaseTree.png" />
      <Texture Name="Ceiba.png" GenerationRGBColor="78735F" GenerationMode="Always" Base="BaseTree.png" />
      <Texture Name="SouthernMagnolia.png" GenerationRGBColor="898884" GenerationMode="Always" Base="BaseTree.png" />
      <Texture Name="Cypress.png" GenerationRGBColor="949492" GenerationMode="Always" Base="BaseTreeHardwood.png" />
      <Texture Name="Mahogany.png" GenerationRGBColor="746265" GenerationMode="Always" Base="BaseTreeHardwood.png" />
      <Texture Name="Toog.png" GenerationRGBColor="AA8B6A" GenerationMode="Always" Base="BaseTreeHardwood.png" />
      <Texture Name="Beech.png" GenerationRGBColor="686152" GenerationMode="Always" Base="BaseTree.png" />
      <Texture Name="Acacia.png" GenerationRGBColor="6D5336" GenerationMode="Always" Base="BaseTree.png" />
      <Texture Name="Breadfruit.png" GenerationRGBColor="BCBBB7" GenerationMode="Always" Base="BaseTree.png" />
      <Texture Name="Lychee.png" GenerationRGBColor="A99385" GenerationMode="Always" Base="BaseTree.png" />
      <Texture Name="CarmelAlmond.png" GenerationRGBColor="9B9195" GenerationMode="Always" Base="BaseTree.png" />
      <Texture Name="Pencil.png" GenerationRGBColor="A2868B" GenerationMode="Always" Base="BaseTree.png" />
      <Texture Name="Malabar.png" GenerationRGBColor="7C6720" GenerationMode="Always" Base="BaseTree.png" />
      <Texture Name="Poplar.png" GenerationRGBColor="D9BD9D" GenerationMode="Always" Base="BaseTree.png" />
      <Texture Name="Ash.png" GenerationRGBColor="B7969A" GenerationMode="Always" Base="BaseTree.png" />
      <Texture Name="BrazilNut.png" GenerationRGBColor="766943" GenerationMode="Always" Base="BaseTree.png" />
      <Texture Name="Fig.png" GenerationRGBColor="937B59" GenerationMode="Always" Base="BaseTree.png" />
      <Texture Name="YellowWalnut.png" GenerationRGBColor="8F7146" GenerationMode="Always" Base="BaseTree.png" />
      <Texture Name="Jambul.png" GenerationRGBColor="906A40" GenerationMode="Always" Base="BaseTree.png" />
      <Texture Name="BlackWalnut.png" GenerationRGBColor="875D34" GenerationMode="Always" Base="BaseTree.png" />
      <Texture Name="Koompassia.png" GenerationRGBColor="A88F72" GenerationMode="Always" Base="BaseTree.png" />
      <Texture Name="Eucalyptus.png" GenerationRGBColor="9D7841" GenerationMode="Always" Base="BaseTree.png" />
      <Texture Name="Tualang.png" GenerationRGBColor="B3ACA4" GenerationMode="Always" Base="BaseTreeHardwood.png" />
      <Texture Name="Durian.png" GenerationRGBColor="6D5444" GenerationMode="Always" Base="BaseTreeHardwood.png" />
      <Texture Name="JackFruit.png" GenerationRGBColor="B9A59A" GenerationMode="Always" Base="BaseTreeHardwood.png" />
      <Texture Name="Maple.png" GenerationRGBColor="7F7A77" GenerationMode="Always" Base="BaseTree.png" />
      <Texture Name="Oak.png" GenerationRGBColor="AC9384" GenerationMode="Always" Base="BaseTree.png" />
      <Texture Name="PlaneTree.png" GenerationRGBColor="A68473" GenerationMode="Always" Base="BaseTree.png" />
      <Texture Name="Elm.png" GenerationRGBColor="939091" GenerationMode="Always" Base="BaseTree.png" />
      <Texture Name="Redwood.png" GenerationRGBColor="A8756B" GenerationMode="Always" Base="BaseTree.png" />
      <Texture Name="DouglasFir.png" GenerationRGBColor="A8978F" GenerationMode="Always" Base="BaseTree.png" />
      <Texture Name="Fir.png" GenerationRGBColor="99826A" GenerationMode="Always" Base="BaseTree.png" />
      <Texture Name="PonderosaPine.png" GenerationRGBColor="8E533F" GenerationMode="Always" Base="BaseTree.png" />
      <Texture Name="Birch.png" GenerationRGBColor="EEEFF4" GenerationMode="Always" Base="BaseTreeHardwood.png" />
      <Texture Name="Alder.png" GenerationRGBColor="9A918C" GenerationMode="Always" Base="BaseTreeHardwood.png" />
      <Texture Name="Pine.png" GenerationRGBColor="6D5551" GenerationMode="Always" Base="BaseTree.png" />
      <Texture Name="WoodBeam.png" GenerationRGBColor="E8CBA2" GenerationMode="Always" Base="BaseNoise.png" />
      <Texture Name="SteelBeam.png" GenerationRGBColor="6E6E6E" GenerationMode="Always" Base="BaseNoise.png" />
      <Texture Name="BlueSpruce.png" GenerationRGBColor="969797" GenerationMode="Always" Base="BaseTree.png" />
      <Texture Name="Spruce.png" GenerationRGBColor="6C6466" GenerationMode="Always" Base="BaseTree.png" />
      <Texture Name="Grass0.png" GenerationRGBColor="545E1E" GenerationMode="Always" Base="BaseNoise.png" />
      <Texture Name="Grass1.png" GenerationRGBColor="555E1E" GenerationMode="Always" Base="BaseNoise.png" />
      <Texture Name="Grass2.png" GenerationRGBColor="565E1E" GenerationMode="Always" Base="BaseNoise.png" />
      <Texture Name="Grass3.png" GenerationRGBColor="575E1E" GenerationMode="Always" Base="BaseNoise.png" />
      <Texture Name="LeavesBroad0.png" GenerationRGBColor="2B4200" GenerationMode="Always" Base="BaseLeavesBroad0.png" />
      <Texture Name="LeavesBroad1.png" GenerationRGBColor="426300" GenerationMode="Always" Base="BaseLeavesBroad1.png" />
      <Texture Name="LeavesBroad2.png" GenerationRGBColor="5A8764" GenerationMode="Always" Base="BaseLeavesBroad2.png" />
      <Texture Name="LeavesBroad3.png" GenerationRGBColor="788335" GenerationMode="Always" Base="BaseLeavesBroad3.png" />
      <Texture Name="LeavesNeedle0.png" GenerationRGBColor="44621A" GenerationMode="Always" Base="BaseLeavesNeedle0.png" />
      <Texture Name="LeavesNeedle1.png" GenerationRGBColor="818C13" GenerationMode="Always" Base="BaseLeavesNeedle1.png" />
      <Texture Name="LeavesNeedle2.png" GenerationRGBColor="73AA7E" GenerationMode="Always" Base="BaseLeavesNeedle2.png" />
      <Texture Name="LeavesBlueSpruce.png" GenerationRGBColor="6A899D" GenerationMode="Always" Base="BaseLeavesNeedle2.png" />
      <Texture Name="LeavesPalm.png" GenerationRGBColor="4B4E0E" GenerationMode="Always" Base="BaseLeavesPalm0.png" />
      <Texture Name="Saguaro.png" GenerationRGBColor="7C8E75" GenerationMode="Always" Base="BaseNoiseMediumContrast.png" />
      <Texture Name="GoldenBarrel.png" GenerationRGBColor="9CA26C" GenerationMode="Always" Base="BaseNoiseHighContrast.png" />
      <Texture Name="EnglishYew.png" GenerationRGBColor="516332" GenerationMode="Always" Base="BaseLeavesNeedle0.png" />
      <Texture Name="Cordia.png" GenerationRGBColor="79844E" GenerationMode="Always" Base="BaseLeavesNeedle0.png" />
      <Texture Name="Jojoba.png" GenerationRGBColor="979D52" GenerationMode="Always" Base="BaseLeavesNeedle0.png" />
      <Texture Name="CandleBush.png" GenerationRGBColor="606D59" GenerationMode="Always" Base="BaseLeavesBroad0.png" />
      <Texture Name="GoldenDewdrop.png" GenerationRGBColor="548343" GenerationMode="Always" Base="BaseLeavesNeedle1.png" />
      <Texture Name="Ixora.png" GenerationRGBColor="798A3D" GenerationMode="Always" Base="BaseLeavesNeedle2.png" />
      <Texture Name="Reserved.png" GenerationRGBColor="0A0A0A" GenerationMode="Always" Base="BaseNoise.png" />
      <Texture Name="RockTBD.png" GenerationRGBColor="A0A0A0" GenerationMode="Always" Base="BaseNoise.png" />
      <Texture Name="OreTBD.png" GenerationRGBColor="A0A0A0" GenerationMode="Always" Base="BaseNoise.png" />
      <Texture Name="GemTBD.png" GenerationRGBColor="A0A0A0" GenerationMode="Always" Base="BaseNoise.png" />
      <Texture Name="Bedrock.png" GenerationRGBColor="0A0A0A" GenerationMode="Always" Base="BaseNoise.png" />
      <Texture Name="Soil.png" GenerationRGBColor="8F6B5A" GenerationMode="Always" Base="BaseNoise.png" />
      <Texture Name="Sand.png" GenerationRGBColor="DBB87E" GenerationMode="Always" Base="BaseNoise.png" />
      <Texture Name="Gravel.png" GenerationRGBColor="A6988E" GenerationMode="Always" Base="BaseNoise.png" />
      <Texture Name="CoarseGravel.png" GenerationRGBColor="A38772" GenerationMode="Always" Base="BaseNoise.png" />
      <Texture Name="Granite.png" GenerationRGBColor="A9AAAB" GenerationMode="Always" Base="BaseNoiseHighContrast.png" />
      <Texture Name="Basalt.png" GenerationRGBColor="8D8183" GenerationMode="Always" Base="BaseNoise.png" />
      <Texture Name="Clay.png" GenerationRGBColor="BBAE9D" GenerationMode="Always" Base="BaseNoise.png" />
      <Texture Name="Sandstone.png" GenerationRGBColor="C6A876" GenerationMode="Always" Base="BaseNoise.png" />
      <Texture Name="Marble.png" GenerationRGBColor="DDBE9D" GenerationMode="Always" Base="BaseVeined.png" />
      <Texture Name="Coal.png" GenerationRGBColor="48484D" GenerationMode="Always" Base="BaseNoise.png" />
      <Texture Name="Charcoal.png" GenerationRGBColor="58585D" GenerationMode="Always" Base="BaseNoise.png" />
      <Texture Name="Limestone.png" GenerationRGBColor="C8B893" GenerationMode="Always" Base="BaseNoise.png" />
      <Texture Name="Slate.png" GenerationRGBColor="535C6B" GenerationMode="Always" Base="BaseNoise.png" />
      <Texture Name="Flint.png" GenerationRGBColor="88725B" GenerationMode="Always" Base="BaseNoise.png" />
      <Texture Name="Phosphorus.png" GenerationRGBColor="50F991" GenerationMode="Always" Base="BaseNoise.png" />
      <Texture Name="AluminumOre.png" GenerationRGBColor="DF755A" GenerationMode="Always" Base="BaseNoise.png" />
      <Texture Name="IronOre.png" GenerationRGBColor="B96030" GenerationMode="Always" Base="BaseNoise.png" />
      <Texture Name="CopperOre.png" GenerationRGBColor="62D0C9" GenerationMode="Always" Base="BaseNoise.png" />
      <Texture Name="SilverOre.png" GenerationRGBColor="839195" GenerationMode="Always" Base="BaseNoise.png" />
      <Texture Name="GoldOre.png" GenerationRGBColor="C7AD47" GenerationMode="Always" Base="BaseNoise.png" />
      <Texture Name="ChromiumOre.png" GenerationRGBColor="A3A7AA" GenerationMode="Always" Base="BaseNoise.png" />